[
  { "run_id": "run-2026-08-05-0007", "sequence": 1, "timestamp": "2026-08-05T14:02:11Z", "event_type": "accepted", "message": "Validation request accepted" },
  { "run_id": "run-2026-08-05-0007", "sequence": 2, "timestamp": "2026-08-05T14:02:14Z", "event_type": "started", "message": "Preparing environment larkspur-sandbox" },
  { "run_id": "run-2026-08-05-0007", "sequence": 3, "timestamp": "2026-08-05T14:02:29Z", "event_type": "progress", "message": "Knowledge package loaded (4 files)" },
  { "run_id": "run-2026-08-05-0007", "sequence": 4, "timestamp": "2026-08-05T14:03:02Z", "event_type": "tool_call", "message": "Read data/billing-ledger.md" },
  { "run_id": "run-2026-08-05-0007", "sequence": 5, "timestamp": "2026-08-05T14:07:45Z", "event_type": "tool_call", "message": "Modified billing/invoice-line generation" },
  { "run_id": "run-2026-08-05-0007", "sequence": 6, "timestamp": "2026-08-05T14:09:31Z", "event_type": "check", "message": "CHK-MIGRATE passed (exit 0)" },
  { "run_id": "run-2026-08-05-0007", "sequence": 7, "timestamp": "2026-08-05T14:12:18Z", "event_type": "check", "message": "CHK-TESTS passed (exit 0)" },
  { "run_id": "run-2026-08-05-0007", "sequence": 8, "timestamp": "2026-08-05T14:12:24Z", "event_type": "completed", "message": "Execution finished" }
]
